{
  "schemaVersion": 1,
  "asOf": "2026-09-06",
  "generatedBy": "tooling/generate-support.mjs",
  "defaultPolicy": "deny",
  "publicationEligible": false,
  "promotionEligible": false,
  "runtimeEligible": false,
  "tierOrder": [
    "unsupported",
    "documented",
    "generated",
    "statically-validated",
    "install-tested",
    "behavior-tested",
    "lifecycle-tested",
    "release-tested",
    "supported"
  ],
  "summary": {
    "bindingCount": 45,
    "supportClaimCount": 0,
    "byTier": {
      "unsupported": 0,
      "documented": 24,
      "generated": 0,
      "statically-validated": 21,
      "install-tested": 0,
      "behavior-tested": 0,
      "lifecycle-tested": 0,
      "release-tested": 0,
      "supported": 0
    }
  },
  "bindings": [
    {
      "bindingId": "agent-plugins-artifact-binding",
      "ecosystemId": "agent-plugins",
      "artifactClass": "passive-public-package",
      "effectiveTier": "documented",
      "rank": 1,
      "supportClaim": false,
      "activeEvidenceIds": [
        "agent-plugins-source-1",
        "agent-plugins-source-2",
        "agent-plugins-source-3"
      ],
      "expiredEvidenceIds": [],
      "futureEvidenceIds": [],
      "satisfiedAssurances": [
        "documentation"
      ],
      "missingAssurances": [
        "artifact-generation"
      ],
      "decay": {
        "state": "none",
        "reason": "No related supporting evidence is expired or future-dated at the authored asOf date."
      },
      "marketplace": {
        "availabilityClaim": false,
        "listingRequired": false,
        "status": "not-claimed",
        "evidenceIds": []
      }
    },
    {
      "bindingId": "agent-skills-artifact-binding",
      "ecosystemId": "agent-skills",
      "artifactClass": "passive-public-package",
      "effectiveTier": "documented",
      "rank": 1,
      "supportClaim": false,
      "activeEvidenceIds": [
        "agent-skills-source-1",
        "agent-skills-source-2"
      ],
      "expiredEvidenceIds": [],
      "futureEvidenceIds": [],
      "satisfiedAssurances": [
        "documentation"
      ],
      "missingAssurances": [
        "artifact-generation"
      ],
      "decay": {
        "state": "none",
        "reason": "No related supporting evidence is expired or future-dated at the authored asOf date."
      },
      "marketplace": {
        "availabilityClaim": false,
        "listingRequired": false,
        "status": "not-claimed",
        "evidenceIds": []
      }
    },
    {
      "bindingId": "aider-artifact-binding",
      "ecosystemId": "aider",
      "artifactClass": "no-artifact",
      "effectiveTier": "documented",
      "rank": 1,
      "supportClaim": false,
      "activeEvidenceIds": [
        "aider-source-1",
        "aider-source-2"
      ],
      "expiredEvidenceIds": [],
      "futureEvidenceIds": [],
      "satisfiedAssurances": [
        "documentation"
      ],
      "missingAssurances": [
        "artifact-generation"
      ],
      "decay": {
        "state": "none",
        "reason": "No related supporting evidence is expired or future-dated at the authored asOf date."
      },
      "marketplace": {
        "availabilityClaim": false,
        "listingRequired": false,
        "status": "not-claimed",
        "evidenceIds": []
      }
    },
    {
      "bindingId": "amazon-q-developer-artifact-binding",
      "ecosystemId": "amazon-q-developer",
      "artifactClass": "no-artifact",
      "effectiveTier": "documented",
      "rank": 1,
      "supportClaim": false,
      "activeEvidenceIds": [
        "amazon-q-developer-source-1",
        "amazon-q-developer-source-2"
      ],
      "expiredEvidenceIds": [],
      "futureEvidenceIds": [],
      "satisfiedAssurances": [
        "documentation"
      ],
      "missingAssurances": [
        "artifact-generation"
      ],
      "decay": {
        "state": "none",
        "reason": "No related supporting evidence is expired or future-dated at the authored asOf date."
      },
      "marketplace": {
        "availabilityClaim": false,
        "listingRequired": false,
        "status": "not-claimed",
        "evidenceIds": []
      }
    },
    {
      "bindingId": "amp-artifact-binding",
      "ecosystemId": "amp",
      "artifactClass": "passive-public-package",
      "effectiveTier": "statically-validated",
      "rank": 3,
      "supportClaim": false,
      "activeEvidenceIds": [
        "amp-source-1",
        "amp-source-2",
        "s5b-amp-static-generation-2026-08-25"
      ],
      "expiredEvidenceIds": [],
      "futureEvidenceIds": [],
      "satisfiedAssurances": [
        "artifact-generation",
        "documentation",
        "static-validation"
      ],
      "missingAssurances": [
        "install"
      ],
      "decay": {
        "state": "none",
        "reason": "No related supporting evidence is expired or future-dated at the authored asOf date."
      },
      "marketplace": {
        "availabilityClaim": false,
        "listingRequired": false,
        "status": "not-claimed",
        "evidenceIds": []
      }
    },
    {
      "bindingId": "augment-auggie-artifact-binding",
      "ecosystemId": "augment-auggie",
      "artifactClass": "passive-public-package",
      "effectiveTier": "statically-validated",
      "rank": 3,
      "supportClaim": false,
      "activeEvidenceIds": [
        "augment-auggie-source-1",
        "augment-auggie-source-2",
        "s5b-augment-static-generation-2026-08-25"
      ],
      "expiredEvidenceIds": [],
      "futureEvidenceIds": [],
      "satisfiedAssurances": [
        "artifact-generation",
        "documentation",
        "static-validation"
      ],
      "missingAssurances": [
        "install"
      ],
      "decay": {
        "state": "none",
        "reason": "No related supporting evidence is expired or future-dated at the authored asOf date."
      },
      "marketplace": {
        "availabilityClaim": false,
        "listingRequired": false,
        "status": "not-claimed",
        "evidenceIds": []
      }
    },
    {
      "bindingId": "claude-code-plugins-artifact-binding",
      "ecosystemId": "claude-code-plugins",
      "artifactClass": "passive-public-package",
      "effectiveTier": "documented",
      "rank": 1,
      "supportClaim": false,
      "activeEvidenceIds": [
        "claude-code-plugins-source-1",
        "claude-code-plugins-source-2",
        "claude-code-plugins-source-3",
        "claude-code-plugins-source-4",
        "claude-code-plugins-source-5"
      ],
      "expiredEvidenceIds": [],
      "futureEvidenceIds": [],
      "satisfiedAssurances": [
        "documentation"
      ],
      "missingAssurances": [
        "artifact-generation"
      ],
      "decay": {
        "state": "none",
        "reason": "No related supporting evidence is expired or future-dated at the authored asOf date."
      },
      "marketplace": {
        "availabilityClaim": false,
        "listingRequired": false,
        "status": "not-claimed",
        "evidenceIds": []
      }
    },
    {
      "bindingId": "cline-artifact-binding",
      "ecosystemId": "cline",
      "artifactClass": "passive-public-package",
      "effectiveTier": "statically-validated",
      "rank": 3,
      "supportClaim": false,
      "activeEvidenceIds": [
        "cline-source-1",
        "cline-source-2",
        "cline-source-3",
        "s5b-cline-static-generation-2026-08-25"
      ],
      "expiredEvidenceIds": [],
      "futureEvidenceIds": [],
      "satisfiedAssurances": [
        "artifact-generation",
        "documentation",
        "static-validation"
      ],
      "missingAssurances": [
        "install"
      ],
      "decay": {
        "state": "none",
        "reason": "No related supporting evidence is expired or future-dated at the authored asOf date."
      },
      "marketplace": {
        "availabilityClaim": false,
        "listingRequired": false,
        "status": "not-claimed",
        "evidenceIds": []
      }
    },
    {
      "bindingId": "continue-artifact-binding",
      "ecosystemId": "continue",
      "artifactClass": "no-artifact",
      "effectiveTier": "documented",
      "rank": 1,
      "supportClaim": false,
      "activeEvidenceIds": [
        "continue-source-1",
        "continue-source-2"
      ],
      "expiredEvidenceIds": [],
      "futureEvidenceIds": [],
      "satisfiedAssurances": [
        "documentation"
      ],
      "missingAssurances": [
        "artifact-generation"
      ],
      "decay": {
        "state": "none",
        "reason": "No related supporting evidence is expired or future-dated at the authored asOf date."
      },
      "marketplace": {
        "availabilityClaim": false,
        "listingRequired": false,
        "status": "not-claimed",
        "evidenceIds": []
      }
    },
    {
      "bindingId": "cursor-plugins-artifact-binding",
      "ecosystemId": "cursor-plugins",
      "artifactClass": "passive-public-package",
      "effectiveTier": "documented",
      "rank": 1,
      "supportClaim": false,
      "activeEvidenceIds": [
        "cursor-plugins-source-1",
        "cursor-plugins-source-2"
      ],
      "expiredEvidenceIds": [],
      "futureEvidenceIds": [],
      "satisfiedAssurances": [
        "documentation"
      ],
      "missingAssurances": [
        "artifact-generation"
      ],
      "decay": {
        "state": "none",
        "reason": "No related supporting evidence is expired or future-dated at the authored asOf date."
      },
      "marketplace": {
        "availabilityClaim": false,
        "listingRequired": false,
        "status": "not-claimed",
        "evidenceIds": []
      }
    },
    {
      "bindingId": "deepseek-deepcode-skills-artifact-binding",
      "ecosystemId": "deepseek-deepcode-skills",
      "artifactClass": "passive-public-package",
      "effectiveTier": "documented",
      "rank": 1,
      "supportClaim": false,
      "activeEvidenceIds": [